{
  "id": "small_size",
  "name": "Small Size",
  "national_dex": 710,
  "types": [
    "Ghost",
    "Grass"
  ],
  "base_stats": {
    "hp": 55,
    "atk": 85,
    "def": 122,
    "spa": 58,
    "spd": 75,
    "spe": 99
  },
  "abilities": [
    "TBD"
  ],
  "hidden_ability": null,
  "learnset": [],
  "evolution": null,
  "dex_entry": "TBD",
  "catch_rate": 45,
  "base_exp": 60,
  "growth_rate": "medium_slow",
  "egg_groups": [
    "TBD"
  ],
  "gender_ratio": 50,
  "is_native_hoenn": false,
  "native_zone": null,
  "is_corrupted": false,
  "corruption_zone": null,
  "corruption_path": null,
  "base_species": null
}