{
  "id": "shiftry",
  "name": "Shiftry",
  "national_dex": 275,
  "types": [
    "Grass",
    "Dark"
  ],
  "base_stats": {
    "hp": 90,
    "atk": 100,
    "def": 60,
    "spa": 90,
    "spd": 60,
    "spe": 80
  },
  "abilities": [
    "TBD"
  ],
  "hidden_ability": null,
  "learnset": [],
  "evolution": null,
  "dex_entry": "TBD",
  "catch_rate": 45,
  "base_exp": 60,
  "growth_rate": "medium_slow",
  "egg_groups": [
    "TBD"
  ],
  "gender_ratio": 50,
  "is_native_hoenn": false,
  "native_zone": null,
  "is_corrupted": false,
  "corruption_zone": null,
  "corruption_path": null,
  "base_species": null
}