{
  "id": "pidgeotto",
  "name": "Pidgeotto",
  "national_dex": 17,
  "types": [
    "Normal",
    "Flying"
  ],
  "base_stats": {
    "hp": 63,
    "atk": 60,
    "def": 55,
    "spa": 50,
    "spd": 50,
    "spe": 71
  },
  "abilities": [
    "TBD"
  ],
  "hidden_ability": null,
  "learnset": [],
  "evolution": null,
  "dex_entry": "TBD",
  "catch_rate": 45,
  "base_exp": 60,
  "growth_rate": "medium_slow",
  "egg_groups": [
    "TBD"
  ],
  "gender_ratio": 50,
  "is_native_hoenn": false,
  "native_zone": null,
  "is_corrupted": false,
  "corruption_zone": null,
  "corruption_path": null,
  "base_species": null
}