{
  "id": "froslass",
  "name": "Froslass",
  "national_dex": 478,
  "types": [
    "Ice",
    "Ghost"
  ],
  "base_stats": {
    "hp": 70,
    "atk": 80,
    "def": 70,
    "spa": 80,
    "spd": 70,
    "spe": 110
  },
  "abilities": [
    "TBD"
  ],
  "hidden_ability": null,
  "learnset": [],
  "evolution": null,
  "dex_entry": "TBD",
  "catch_rate": 45,
  "base_exp": 60,
  "growth_rate": "medium_slow",
  "egg_groups": [
    "TBD"
  ],
  "gender_ratio": 50,
  "is_native_hoenn": false,
  "native_zone": null,
  "is_corrupted": false,
  "corruption_zone": null,
  "corruption_path": null,
  "base_species": null
}