{
  "id": "gallade",
  "name": "Gallade",
  "national_dex": 475,
  "types": [
    "Psychic",
    "Fighting"
  ],
  "base_stats": {
    "hp": 68,
    "atk": 125,
    "def": 65,
    "spa": 65,
    "spd": 115,
    "spe": 80
  },
  "abilities": [
    "TBD"
  ],
  "hidden_ability": null,
  "learnset": [],
  "evolution": null,
  "dex_entry": "TBD",
  "catch_rate": 45,
  "base_exp": 60,
  "growth_rate": "medium_slow",
  "egg_groups": [
    "TBD"
  ],
  "gender_ratio": 50,
  "is_native_hoenn": false,
  "native_zone": null,
  "is_corrupted": false,
  "corruption_zone": null,
  "corruption_path": null,
  "base_species": null
}