{
  "id": "magnezone",
  "name": "Magnezone",
  "national_dex": 462,
  "types": [
    "Electric",
    "Steel"
  ],
  "base_stats": {
    "hp": 70,
    "atk": 70,
    "def": 115,
    "spa": 130,
    "spd": 90,
    "spe": 60
  },
  "abilities": [
    "TBD"
  ],
  "hidden_ability": null,
  "learnset": [],
  "evolution": null,
  "dex_entry": "TBD",
  "catch_rate": 45,
  "base_exp": 60,
  "growth_rate": "medium_slow",
  "egg_groups": [
    "TBD"
  ],
  "gender_ratio": 50,
  "is_native_hoenn": false,
  "native_zone": null,
  "is_corrupted": false,
  "corruption_zone": null,
  "corruption_path": null,
  "base_species": null
}