{
  "id": "malamar",
  "name": "Malamar",
  "national_dex": 687,
  "types": [
    "Dark",
    "Psychic"
  ],
  "base_stats": {
    "hp": 86,
    "atk": 92,
    "def": 88,
    "spa": 68,
    "spd": 75,
    "spe": 73
  },
  "abilities": [
    "TBD"
  ],
  "hidden_ability": null,
  "learnset": [],
  "evolution": null,
  "dex_entry": "TBD",
  "catch_rate": 45,
  "base_exp": 60,
  "growth_rate": "medium_slow",
  "egg_groups": [
    "TBD"
  ],
  "gender_ratio": 50,
  "is_native_hoenn": false,
  "native_zone": null,
  "is_corrupted": false,
  "corruption_zone": null,
  "corruption_path": null,
  "base_species": null
}