{
  "id": "azumarill",
  "name": "Azumarill",
  "national_dex": 184,
  "types": [
    "Water",
    "Fairy"
  ],
  "base_stats": {
    "hp": 100,
    "atk": 50,
    "def": 80,
    "spa": 60,
    "spd": 80,
    "spe": 50
  },
  "abilities": [
    "TBD"
  ],
  "hidden_ability": null,
  "learnset": [],
  "evolution": null,
  "dex_entry": "TBD",
  "catch_rate": 45,
  "base_exp": 60,
  "growth_rate": "medium_slow",
  "egg_groups": [
    "TBD"
  ],
  "gender_ratio": 50,
  "is_native_hoenn": false,
  "native_zone": null,
  "is_corrupted": false,
  "corruption_zone": null,
  "corruption_path": null,
  "base_species": null
}