{
  "id": "gengar",
  "name": "Gengar",
  "national_dex": 94,
  "types": [
    "Ghost",
    "Poison"
  ],
  "base_stats": {
    "hp": 60,
    "atk": 65,
    "def": 60,
    "spa": 130,
    "spd": 75,
    "spe": 110
  },
  "abilities": [
    "TBD"
  ],
  "hidden_ability": null,
  "learnset": [],
  "evolution": null,
  "dex_entry": "TBD",
  "catch_rate": 45,
  "base_exp": 60,
  "growth_rate": "medium_slow",
  "egg_groups": [
    "TBD"
  ],
  "gender_ratio": 50,
  "is_native_hoenn": false,
  "native_zone": null,
  "is_corrupted": false,
  "corruption_zone": null,
  "corruption_path": null,
  "base_species": null
}