{
  "id": "hisuian_voltorb",
  "name": "Hisuian Voltorb",
  "national_dex": 100,
  "types": [
    "Electric",
    "Grass"
  ],
  "base_stats": {
    "hp": 40,
    "atk": 30,
    "def": 50,
    "spa": 55,
    "spd": 55,
    "spe": 100
  },
  "abilities": [
    "TBD"
  ],
  "hidden_ability": null,
  "learnset": [],
  "evolution": null,
  "dex_entry": "TBD",
  "catch_rate": 45,
  "base_exp": 60,
  "growth_rate": "medium_slow",
  "egg_groups": [
    "TBD"
  ],
  "gender_ratio": 50,
  "is_native_hoenn": false,
  "native_zone": null,
  "is_corrupted": false,
  "corruption_zone": null,
  "corruption_path": null,
  "base_species": null
}