{
  "id": "droopy_form",
  "name": "Droopy Form",
  "national_dex": 978,
  "types": [
    "Dragon",
    "Water"
  ],
  "base_stats": {
    "hp": 68,
    "atk": 50,
    "def": 60,
    "spa": 120,
    "spd": 95,
    "spe": 82
  },
  "abilities": [
    "TBD"
  ],
  "hidden_ability": null,
  "learnset": [],
  "evolution": null,
  "dex_entry": "TBD",
  "catch_rate": 45,
  "base_exp": 60,
  "growth_rate": "medium_slow",
  "egg_groups": [
    "TBD"
  ],
  "gender_ratio": 50,
  "is_native_hoenn": false,
  "native_zone": null,
  "is_corrupted": false,
  "corruption_zone": null,
  "corruption_path": null,
  "base_species": null
}