{
  "id": "litleo",
  "name": "Litleo",
  "national_dex": 667,
  "types": [
    "Fire",
    "Normal"
  ],
  "base_stats": {
    "hp": 62,
    "atk": 50,
    "def": 58,
    "spa": 73,
    "spd": 54,
    "spe": 72
  },
  "abilities": [
    "TBD"
  ],
  "hidden_ability": null,
  "learnset": [],
  "evolution": null,
  "dex_entry": "TBD",
  "catch_rate": 45,
  "base_exp": 60,
  "growth_rate": "medium_slow",
  "egg_groups": [
    "TBD"
  ],
  "gender_ratio": 50,
  "is_native_hoenn": false,
  "native_zone": null,
  "is_corrupted": false,
  "corruption_zone": null,
  "corruption_path": null,
  "base_species": null
}